{
  "schemaVersion": 0,
  "product": "eon-stream",
  "channel": "alpha",
  "version": "0.12.0-alpha",
  "tag": "v0.12",
  "releasedAt": "2026-10-04T00:00:00Z",
  "notesUrl": "https://github.com/EON-Extensible-Open-Network/eon-stream-app/releases/tag/v0.12",
  "artifacts": [
    {
      "platform": "windows",
      "arch": "x86_64",
      "filename": "eon-stream-v0.12-windows-x86_64.exe",
      "size": 4194304,
      "sha256": "e3b0c44298fc1c149afbf4c8996fb92427ae41e4649b934ca495991b7852b855",
      "url": "https://github.com/EON-Extensible-Open-Network/eon-stream-app/releases/download/v0.12/eon-stream-v0.12-windows-x86_64.exe"
    }
  ]
}
